"No.","Time","Source","Destination","Protocol","Length","Info"
"1","08:32:48.649930","10.215.173.1","157.240.245.12","QUIC","1280","Initial, DCID=f0d99950a38d41ea, PKN: 2675659, CRYPTO, PADDING"
"2","08:32:48.670617","10.215.173.1","10.215.173.2","DNS","64","Standard query 0xe5cc A graph.facebook.com"
"3","08:32:48.710178","10.215.173.1","157.240.245.23","UDP","1260","57363  >  443 Len=1232"
"4","08:32:48.711587","10.215.173.1","157.240.245.23","UDP","76","57363  >  443 Len=48"
"5","08:32:48.711772","10.215.173.1","157.240.245.23","UDP","1260","57363  >  443 Len=1232"
"6","08:32:48.711914","10.215.173.1","157.240.245.23","UDP","1260","57363  >  443 Len=1232"
"7","08:32:48.711978","10.215.173.1","157.240.245.23","UDP","1260","57363  >  443 Len=1232"
"8","08:32:48.712043","10.215.173.1","157.240.245.23","UDP","1260","57363  >  443 Len=1232"
"9","08:32:48.712107","10.215.173.1","157.240.245.23","UDP","620","57363  >  443 Len=592"
"10","08:32:48.713260","10.215.173.1","10.215.173.2","DNS","77","Standard query 0x68cd A z-p42-chat-e2ee-ig.facebook.com"
"11","08:32:48.715599","10.215.173.1","157.240.245.175","TCP","60","43702  >  5222 [SYN] Seq=0 Win=65535 Len=0 MSS=9960 SACK_PERM TSval=822060135 TSecr=0 WS=256"
"12","08:32:48.729541","10.215.173.2","10.215.173.1","DNS","116","Standard query response 0xe5cc A graph.facebook.com CNAME star.c10r.facebook.com A 157.240.245.13"
"13","08:32:48.733328","10.215.173.2","10.215.173.1","DNS","141","Standard query response 0x68cd A z-p42-chat-e2ee-ig.facebook.com CNAME chat-e2ee-ig-p42.c10r.facebook.com A 157.240.245.175"
"14","08:32:48.733525","157.240.245.175","10.215.173.1","TCP","48","5222  >  43702 [SYN, ACK] Seq=0 Ack=1 Win=2048 Len=0 MSS=9960 WS=256"
"15","08:32:48.733610","10.215.173.1","157.240.245.175","TCP","40","43702  >  5222 [ACK] Seq=1 Ack=1 Win=65536 Len=0"
"16","08:32:48.735916","10.215.173.1","10.215.173.2","DNS","62","Standard query 0x56d1 A mtalk.google.com"
"17","08:32:48.738437","10.215.173.1","157.240.245.13","TCP","60","33026  >  443 [SYN] Seq=0 Win=65535 Len=0 MSS=9960 SACK_PERM TSval=1048728009 TSecr=0 WS=256"
"18","08:32:48.739047","10.215.173.1","157.240.245.175","TCP","44","43702  >  5222 [PSH, ACK] Seq=1 Ack=1 Win=65536 Len=4 [TCP PDU reassembled in 147]"
"19","08:32:48.739130","10.215.173.1","157.240.245.175","TCP","47","43702  >  5222 [PSH, ACK] Seq=5 Ack=1 Win=65536 Len=7 [TCP PDU reassembled in 147]"
"20","08:32:48.739146","10.215.173.1","157.240.245.175","TCP","44","43702  >  5222 [PSH, ACK] Seq=12 Ack=1 Win=65536 Len=4 [TCP PDU reassembled in 147]"
"21","08:32:48.739233","157.240.245.175","10.215.173.1","TCP","40","5222  >  43702 [ACK] Seq=1 Ack=16 Win=524032 Len=0"
"22","08:32:48.739695","10.215.173.1","157.240.245.12","QUIC","1280","Initial, DCID=f0d99950a38d41ea, PKN: 2675661, CRYPTO, PADDING"
"23","08:32:48.743401","10.215.173.1","157.240.245.175","TCP","3069","43702  >  5222 [PSH, ACK] Seq=16 Ack=1 Win=65536 Len=3029 [TCP PDU reassembled in 147]"
"24","08:32:48.743514","157.240.245.175","10.215.173.1","TCP","40","5222  >  43702 [ACK] Seq=1 Ack=3045 Win=521216 Len=0"
"25","08:32:48.744004","10.215.173.2","10.215.173.1","DNS","117","Standard query response 0x56d1 A mtalk.google.com CNAME mobile-gtalk.l.google.com A 172.253.63.188"
"26","08:32:48.744158","157.240.245.13","10.215.173.1","TCP","48","443  >  33026 [SYN, ACK] Seq=0 Ack=1 Win=2048 Len=0 MSS=9960 WS=256"
"27","08:32:48.744224","10.215.173.1","157.240.245.13","TCP","40","33026  >  443 [ACK] Seq=1 Ack=1 Win=65536 Len=0"
"28","08:32:48.745129","10.215.173.1","157.240.245.13","TLSv1.3","557","Client Hello (SNI=graph.facebook.com)"
"29","08:32:48.745278","157.240.245.13","10.215.173.1","TCP","40","443  >  33026 [ACK] Seq=1 Ack=518 Win=523520 Len=0"
"30","08:32:48.751783","157.240.245.13","10.215.173.1","TLSv1.3","252","Server Hello, Change Cipher Spec, Application Data"
"31","08:32:48.756182","10.215.173.1","157.240.245.13","TCP","40","33026  >  443 [ACK] Seq=518 Ack=213 Win=66816 Len=0"
"32","08:32:48.756778","10.215.173.1","172.253.63.188","TCP","60","58186  >  5228 [SYN] Seq=0 Win=65535 Len=0 MSS=9960 SACK_PERM TSval=2248821005 TSecr=0 WS=256"
"33","08:32:48.757472","10.215.173.1","157.240.245.13","TLSv1.3","104","Change Cipher Spec, Application Data"
"34","08:32:48.757546","157.240.245.13","10.215.173.1","TCP","40","443  >  33026 [ACK] Seq=213 Ack=582 Win=524032 Len=0"
"35","08:32:48.757628","10.215.173.1","157.240.245.13","TLSv1.3","5023","Application Data, Application Data, Application Data, Application Data"
"36","08:32:48.757667","157.240.245.13","10.215.173.1","TCP","40","443  >  33026 [ACK] Seq=213 Ack=5565 Win=519168 Len=0"
"37","08:32:48.762074","157.240.245.13","10.215.173.1","TLSv1.3","337","Application Data, Application Data, Application Data"
"38","08:32:48.762921","10.215.173.1","157.240.245.13","TLSv1.3","71","Application Data"
"39","08:32:48.762993","157.240.245.13","10.215.173.1","TCP","40","443  >  33026 [ACK] Seq=510 Ack=5596 Win=524032 Len=0"
"40","08:32:48.808288","10.215.173.1","157.240.245.23","UDP","1253","57363  >  443 Len=1225"
"41","08:32:48.808441","10.215.173.1","157.240.245.23","UDP","1253","57363  >  443 Len=1225"
"42","08:32:48.824117","10.215.173.1","10.215.173.2","DNS","66","Standard query 0xb321 A gateway.facebook.com"
"43","08:32:48.829572","172.253.63.188","10.215.173.1","TCP","48","5228  >  58186 [SYN, ACK] Seq=0 Ack=1 Win=2048 Len=0 MSS=9960 WS=256"
"44","08:32:48.829794","10.215.173.1","172.253.63.188","TCP","40","58186  >  5228 [ACK] Seq=1 Ack=1 Win=65536 Len=0"
"45","08:32:48.829837","157.240.245.175","10.215.173.1","TCP","97","5222  >  43702 [PSH, ACK] Seq=1 Ack=3045 Win=524288 Len=57 [TCP PDU reassembled in 187]"
"46","08:32:48.830012","157.240.245.13","10.215.173.1","TLSv1.3","619","Application Data"
"47","08:32:48.830747","10.215.173.1","157.240.245.175","TCP","40","43702  >  5222 [ACK] Seq=3045 Ack=58 Win=65536 Len=0"
"48","08:32:48.832213","10.215.173.1","172.253.63.188","TLSv1.3","557","Client Hello (SNI=mtalk.google.com)"
"49","08:32:48.832557","172.253.63.188","10.215.173.1","TCP","40","5228  >  58186 [ACK] Seq=1 Ack=518 Win=523520 Len=0"
"50","08:32:48.832774","10.215.173.2","10.215.173.1","DNS","117","Standard query response 0xb321 A gateway.facebook.com CNAME dgw.c10r.facebook.com A 157.240.245.12"
"51","08:32:48.836001","10.215.173.1","157.240.245.12","TCP","60","42702  >  443 [SYN] Seq=0 Win=65535 Len=0 MSS=9960 SACK_PERM TSval=3707235135 TSecr=0 WS=256"
"52","08:32:48.837553","157.240.245.175","10.215.173.1","TCP","91","5222  >  43702 [PSH, ACK] Seq=58 Ack=3045 Win=524288 Len=51 [TCP PDU reassembled in 187]"
"53","08:32:48.837821","10.215.173.1","157.240.245.13","TLSv1.3","1273","Application Data"
"54","08:32:48.837858","10.215.173.1","157.240.245.175","TCP","40","43702  >  5222 [ACK] Seq=3045 Ack=109 Win=65536 Len=0"
"55","08:32:48.837963","157.240.245.13","10.215.173.1","TCP","40","443  >  33026 [ACK] Seq=1089 Ack=6829 Win=523008 Len=0"
"56","08:32:48.841501","157.240.245.12","10.215.173.1","TCP","48","443  >  42702 [SYN, ACK] Seq=0 Ack=1 Win=2048 Len=0 MSS=9960 WS=256"
"57","08:32:48.841734","10.215.173.1","157.240.245.12","TCP","40","42702  >  443 [ACK] Seq=1 Ack=1 Win=65536 Len=0"
"58","08:32:48.841772","157.240.245.13","10.215.173.1","TLSv1.3","75","Application Data"
"59","08:32:48.842182","10.215.173.1","157.240.245.175","TCP","84","43702  >  5222 [PSH, ACK] Seq=3045 Ack=109 Win=65536 Len=44 [TCP PDU reassembled in 147]"
"60","08:32:48.842293","157.240.245.175","10.215.173.1","TCP","40","5222  >  43702 [ACK] Seq=109 Ack=3089 Win=524032 Len=0"
"61","08:32:48.845242","10.215.173.1","157.240.245.12","TLSv1.3","251","Client Hello (SNI=gateway.facebook.com)"
"62","08:32:48.845574","157.240.245.12","10.215.173.1","TCP","40","443  >  42702 [ACK] Seq=1 Ack=212 Win=524032 Len=0"
"63","08:32:48.851873","172.253.63.188","10.215.173.1","TLSv1.3","6674","Server Hello, Change Cipher Spec, Application Data"
"64","08:32:48.852074","157.240.245.12","10.215.173.1","TLSv1.3","3328","Server Hello, Change Cipher Spec, Application Data, Application Data, Application Data"
"65","08:32:48.852162","10.215.173.1","172.253.63.188","TCP","40","58186  >  5228 [ACK] Seq=518 Ack=6635 Win=85504 Len=0"
"66","08:32:48.852166","10.215.173.1","157.240.245.12","TCP","40","42702  >  443 [ACK] Seq=212 Ack=3289 Win=85504 Len=0"
"67","08:32:48.855244","10.215.173.1","172.253.63.188","TLSv1.3","104","Change Cipher Spec, Application Data"
"68","08:32:48.855324","172.253.63.188","10.215.173.1","TCP","40","5228  >  58186 [ACK] Seq=6635 Ack=582 Win=524032 Len=0"
"69","08:32:48.870114","10.215.173.1","157.240.245.12","TLSv1.3","46","Change Cipher Spec"
"70","08:32:48.870215","157.240.245.12","10.215.173.1","TCP","40","443  >  42702 [ACK] Seq=3289 Ack=218 Win=524032 Len=0"
"71","08:32:48.870344","10.215.173.1","157.240.245.12","TLSv1.3","109","Application Data"
"72","08:32:48.870389","157.240.245.12","10.215.173.1","TCP","40","443  >  42702 [ACK] Seq=3289 Ack=287 Win=524032 Len=0"
"73","08:32:48.870844","10.215.173.1","157.240.245.12","TLSv1.3","93","Application Data"
"74","08:32:48.870911","157.240.245.12","10.215.173.1","TCP","40","443  >  42702 [ACK] Seq=3289 Ack=340 Win=524032 Len=0"
"75","08:32:48.870990","10.215.173.1","157.240.245.12","TLSv1.3","93","Application Data"
"76","08:32:48.871028","157.240.245.12","10.215.173.1","TCP","40","443  >  42702 [ACK] Seq=3289 Ack=393 Win=524032 Len=0"
"77","08:32:48.871095","10.215.173.1","157.240.245.12","TLSv1.3","77","Application Data"
"78","08:32:48.871134","157.240.245.12","10.215.173.1","TCP","40","443  >  42702 [ACK] Seq=3289 Ack=430 Win=524032 Len=0"
"79","08:32:48.871211","10.215.173.1","157.240.245.12","TLSv1.3","573","Application Data"
"80","08:32:48.871250","157.240.245.12","10.215.173.1","TCP","40","443  >  42702 [ACK] Seq=3289 Ack=963 Win=523520 Len=0"
"81","08:32:48.871341","10.215.173.1","157.240.245.12","TLSv1.3","1309","Application Data"
"82","08:32:48.871380","157.240.245.12","10.215.173.1","TCP","40","443  >  42702 [ACK] Seq=3289 Ack=2232 Win=522240 Len=0"
"83","08:32:48.886397","10.215.173.1","172.253.63.188","TLSv1.3","561","Application Data"
"84","08:32:48.886575","172.253.63.188","10.215.173.1","TCP","40","5228  >  58186 [ACK] Seq=6635 Ack=1103 Win=523520 Len=0"
"85","08:32:48.889454","10.215.173.1","157.240.245.13","TCP","40","33026  >  443 [ACK] Seq=6829 Ack=1124 Win=68864 Len=0"
"86","08:32:48.912621","10.215.173.1","172.253.63.188","TLSv1.3","513","Application Data"
"87","08:32:48.914096","172.253.63.188","10.215.173.1","TCP","40","5228  >  58186 [ACK] Seq=6635 Ack=1576 Win=523008 Len=0"
"88","08:32:48.930921","157.240.245.13","10.215.173.1","TLSv1.3","301","Application Data"
"89","08:32:48.931055","10.215.173.1","157.240.245.13","TCP","40","33026  >  443 [ACK] Seq=6829 Ack=1385 Win=70144 Len=0"
"90","08:32:48.931117","157.240.245.12","10.215.173.1","TLSv1.3","337","Application Data, Application Data, Application Data"
"91","08:32:48.931363","10.215.173.1","157.240.245.12","TLSv1.3","77","Application Data"
"92","08:32:48.931416","157.240.245.12","10.215.173.1","TCP","40","443  >  42702 [ACK] Seq=3586 Ack=2269 Win=524032 Len=0"
"93","08:32:48.940512","10.215.173.1","157.240.245.12","QUIC","1280","Initial, DCID=f0d99950a38d41ea, PKN: 2675663, CRYPTO, PADDING"
"94","08:32:48.941864","172.253.63.188","10.215.173.1","TLSv1.3","575","Application Data, Application Data"
"95","08:32:48.964487","172.253.63.188","10.215.173.1","TLSv1.3","274","Application Data, Application Data, Application Data, Application Data"
"96","08:32:48.967955","10.215.173.1","172.253.63.188","TCP","40","58186  >  5228 [ACK] Seq=1576 Ack=7404 Win=112128 Len=0"
"97","08:32:48.993036","10.215.173.1","172.253.63.188","TLSv1.3","78","Application Data"
"98","08:32:48.993135","172.253.63.188","10.215.173.1","TCP","40","5228  >  58186 [ACK] Seq=7404 Ack=1614 Win=524032 Len=0"
"99","08:32:49.033550","157.240.245.12","10.215.173.1","TLSv1.3","255","Application Data, Application Data"
"100","08:32:49.039164","10.215.173.1","157.240.245.23","UDP","1253","57363  >  443 Len=1225"
"101","08:32:49.039435","10.215.173.1","157.240.245.23","UDP","1253","57363  >  443 Len=1225"
"102","08:32:49.045761","172.253.63.188","10.215.173.1","TCP","40","5228  >  58186 [RST, ACK] Seq=7404 Ack=1614 Win=65280 Len=0"
"103","08:32:49.061870","10.215.173.1","172.253.63.188","TCP","60","58200  >  5228 [SYN] Seq=0 Win=65535 Len=0 MSS=9960 SACK_PERM TSval=2248821313 TSecr=0 WS=256"
"104","08:32:49.077761","172.253.63.188","10.215.173.1","TCP","48","5228  >  58200 [SYN, ACK] Seq=0 Ack=1 Win=2048 Len=0 MSS=9960 WS=256"
"105","08:32:49.078199","10.215.173.1","172.253.63.188","TCP","40","58200  >  5228 [ACK] Seq=1 Ack=1 Win=65536 Len=0"
"106","08:32:49.081404","10.215.173.1","157.240.245.12","TCP","40","42702  >  443 [ACK] Seq=2269 Ack=3801 Win=98816 Len=0"
"107","08:32:49.082915","10.215.173.1","172.253.63.188","TLSv1.3","557","Client Hello (SNI=mtalk.google.com)"
"108","08:32:49.083565","172.253.63.188","10.215.173.1","TCP","40","5228  >  58200 [ACK] Seq=1 Ack=518 Win=523520 Len=0"
"109","08:32:49.102528","172.253.63.188","10.215.173.1","TLSv1.3","2840","Server Hello, Change Cipher Spec"
"110","08:32:49.102702","10.215.173.1","172.253.63.188","TCP","40","58200  >  5228 [ACK] Seq=518 Ack=2801 Win=85504 Len=0"
"111","08:32:49.102711","172.253.63.188","10.215.173.1","TLSv1.3","3874","Application Data"
"112","08:32:49.102723","10.215.173.1","172.253.63.188","TCP","40","58200  >  5228 [ACK] Seq=518 Ack=6635 Win=93184 Len=0"
"113","08:32:49.110188","10.215.173.1","157.240.245.63","TCP","60","42068  >  443 [SYN] Seq=0 Win=65535 Len=0 MSS=9960 SACK_PERM TSval=2990858690 TSecr=0 WS=256"
"114","08:32:49.115214","10.215.173.1","10.215.173.2","DNS","61","Standard query 0xbdb4 A i.instagram.com"
"115","08:32:49.124696","10.215.173.1","157.240.245.63","TCP","60","42070  >  443 [SYN] Seq=0 Win=65535 Len=0 MSS=9960 SACK_PERM TSval=2990858699 TSecr=0 WS=256"
"116","08:32:49.126069","157.240.245.175","10.215.173.1","TCP","136","5222  >  43702 [PSH, ACK] Seq=109 Ack=3089 Win=524288 Len=96 [TCP PDU reassembled in 187]"
"117","08:32:49.126348","157.240.245.63","10.215.173.1","TCP","48","443  >  42068 [SYN, ACK] Seq=0 Ack=1 Win=2048 Len=0 MSS=9960 WS=256"
"118","08:32:49.126874","10.215.173.1","157.240.245.63","TCP","40","42068  >  443 [ACK] Seq=1 Ack=1 Win=65536 Len=0"
"119","08:32:49.127679","10.215.173.2","10.215.173.1","DNS","119","Standard query response 0xbdb4 A i.instagram.com CNAME instagram.c10r.instagram.com A 157.240.245.63"
"120","08:32:49.137510","157.240.245.63","10.215.173.1","TCP","48","443  >  42070 [SYN, ACK] Seq=0 Ack=1 Win=2048 Len=0 MSS=9960 WS=256"
"121","08:32:49.137724","10.215.173.1","157.240.245.63","TCP","40","42070  >  443 [ACK] Seq=1 Ack=1 Win=65536 Len=0"
"122","08:32:49.147336","157.240.245.12","10.215.173.1","TLSv1.3","5583","Application Data, Application Data, Application Data"
"123","08:32:49.147508","10.215.173.1","157.240.245.12","TCP","40","42702  >  443 [ACK] Seq=2269 Ack=9344 Win=118528 Len=0"
"124","08:32:49.150146","10.215.173.1","157.240.245.63","TLSv1.3","416","Client Hello (SNI=i.instagram.com)"
"125","08:32:49.150478","157.240.245.12","10.215.173.1","TLSv1.3","88","Application Data"
"126","08:32:49.150847","157.240.245.63","10.215.173.1","TCP","40","443  >  42070 [ACK] Seq=1 Ack=377 Win=523776 Len=0"
"127","08:32:49.151108","10.215.173.1","157.240.245.12","TCP","40","42702  >  443 [ACK] Seq=2269 Ack=9392 Win=118528 Len=0"
"128","08:32:49.155411","10.215.173.1","157.240.245.63","TLSv1.3","416","Client Hello (SNI=i.instagram.com)"
"129","08:32:49.155856","157.240.245.63","10.215.173.1","TCP","40","443  >  42068 [ACK] Seq=1 Ack=377 Win=523776 Len=0"
"130","08:32:49.157802","157.240.245.63","10.215.173.1","TLSv1.3","252","Server Hello, Change Cipher Spec, Application Data"
"131","08:32:49.157977","10.215.173.1","157.240.245.63","TCP","40","42070  >  443 [ACK] Seq=377 Ack=213 Win=66816 Len=0"
"132","08:32:49.161867","157.240.245.63","10.215.173.1","TLSv1.3","252","Server Hello, Change Cipher Spec, Application Data"
"133","08:32:49.162167","10.215.173.1","157.240.245.63","TCP","40","42068  >  443 [ACK] Seq=377 Ack=213 Win=66816 Len=0"
"134","08:32:49.173254","157.240.245.175","10.215.173.1","TCP","77","5222  >  43702 [PSH, ACK] Seq=205 Ack=3089 Win=524288 Len=37 [TCP PDU reassembled in 187]"
"135","08:32:49.173380","10.215.173.1","157.240.245.175","TCP","40","43702  >  5222 [ACK] Seq=3089 Ack=242 Win=65536 Len=0"
"136","08:32:49.175518","10.215.173.1","157.240.245.63","TLSv1.3","46","Change Cipher Spec"
"137","08:32:49.175707","157.240.245.63","10.215.173.1","TCP","40","443  >  42070 [ACK] Seq=213 Ack=383 Win=524032 Len=0"
"138","08:32:49.176068","10.215.173.1","157.240.245.63","TLSv1.3","109","Application Data"
"139","08:32:49.177051","157.240.245.63","10.215.173.1","TCP","40","443  >  42070 [ACK] Seq=213 Ack=452 Win=524032 Len=0"
"140","08:32:49.177155","10.215.173.1","172.253.63.188","TLSv1.3","104","Change Cipher Spec, Application Data"
"141","08:32:49.177334","172.253.63.188","10.215.173.1","TCP","40","5228  >  58200 [ACK] Seq=6635 Ack=582 Win=524032 Len=0"
"142","08:32:49.181543","157.240.245.63","10.215.173.1","TLSv1.3","296","Application Data, Application Data"
"143","08:32:49.187438","10.215.173.1","157.240.245.63","TLSv1.3","46","Change Cipher Spec"
"144","08:32:49.187618","157.240.245.63","10.215.173.1","TCP","40","443  >  42068 [ACK] Seq=213 Ack=383 Win=524032 Len=0"
"145","08:32:49.187934","10.215.173.1","157.240.245.63","TLSv1.3","109","Application Data"
"146","08:32:49.188034","157.240.245.63","10.215.173.1","TCP","40","443  >  42068 [ACK] Seq=213 Ack=452 Win=524032 Len=0"
"147","08:32:49.189868","10.215.173.1","157.240.245.175","TCP","84","43702  >  5222 [PSH, ACK] Seq=3089 Ack=242 Win=65536 Len=44 [TCP PDU reassembled in 147]"
"148","08:32:49.189940","157.240.245.175","10.215.173.1","TCP","40","5222  >  43702 [ACK] Seq=242 Ack=3133 Win=524032 Len=0"
"149","08:32:49.191928","10.215.173.1","157.240.245.63","TLSv1.3","93","Application Data"
"150","08:32:49.192111","157.240.245.63","10.215.173.1","TCP","40","443  >  42068 [ACK] Seq=213 Ack=505 Win=524032 Len=0"
"151","08:32:49.192246","157.240.245.63","10.215.173.1","TLSv1.3","222","Application Data"
"152","08:32:49.192683","10.215.173.1","157.240.245.63","TLSv1.3","93","Application Data"
"153","08:32:49.192815","157.240.245.63","10.215.173.1","TLSv1.3","114","Application Data"
"154","08:32:49.193033","157.240.245.63","10.215.173.1","TCP","40","443  >  42068 [ACK] Seq=469 Ack=558 Win=524032 Len=0"
"155","08:32:49.193346","10.215.173.1","157.240.245.63","TLSv1.3","77","Application Data"
"156","08:32:49.193485","157.240.245.63","10.215.173.1","TCP","40","443  >  42068 [ACK] Seq=469 Ack=595 Win=524032 Len=0"
"157","08:32:49.194090","10.215.173.1","157.240.245.63","TLSv1.3","2285","Application Data"
"158","08:32:49.194267","157.240.245.63","10.215.173.1","TCP","40","443  >  42068 [ACK] Seq=469 Ack=2840 Win=521728 Len=0"
"159","08:32:49.194528","10.215.173.1","157.240.245.63","TLSv1.3","221","Application Data"
"160","08:32:49.194645","157.240.245.63","10.215.173.1","TCP","40","443  >  42068 [ACK] Seq=469 Ack=3021 Win=521472 Len=0"
"161","08:32:49.194982","10.215.173.1","157.240.245.63","TLSv1.3","93","Application Data"
"162","08:32:49.195106","157.240.245.63","10.215.173.1","TCP","40","443  >  42070 [ACK] Seq=469 Ack=505 Win=524032 Len=0"
"163","08:32:49.195380","10.215.173.1","157.240.245.63","TLSv1.3","93","Application Data"
"164","08:32:49.195510","157.240.245.63","10.215.173.1","TCP","40","443  >  42070 [ACK] Seq=469 Ack=558 Win=524032 Len=0"
"165","08:32:49.195798","10.215.173.1","157.240.245.63","TLSv1.3","77","Application Data"
"166","08:32:49.195922","157.240.245.63","10.215.173.1","TCP","40","443  >  42070 [ACK] Seq=469 Ack=595 Win=524032 Len=0"
"167","08:32:49.196549","157.240.245.63","10.215.173.1","TLSv1.3","71","Application Data"
"168","08:32:49.197001","10.215.173.1","157.240.245.63","TLSv1.3","2285","Application Data"
"169","08:32:49.197184","157.240.245.63","10.215.173.1","TCP","40","443  >  42070 [ACK] Seq=469 Ack=2840 Win=521728 Len=0"
"170","08:32:49.197479","10.215.173.1","157.240.245.63","TLSv1.3","221","Application Data"
"171","08:32:49.197526","157.240.245.63","10.215.173.1","TCP","40","443  >  42070 [ACK] Seq=469 Ack=3021 Win=521472 Len=0"
"172","08:32:49.197733","10.215.173.1","157.240.245.63","TLSv1.3","77","Application Data"
"173","08:32:49.197840","157.240.245.63","10.215.173.1","TCP","40","443  >  42070 [ACK] Seq=469 Ack=3058 Win=521472 Len=0"
"174","08:32:49.198515","10.215.173.1","157.240.245.63","TLSv1.3","77","Application Data"
"175","08:32:49.198582","157.240.245.63","10.215.173.1","TLSv1.3","75","Application Data"
"176","08:32:49.198641","157.240.245.63","10.215.173.1","TLSv1.3","71","Application Data"
"177","08:32:49.198715","157.240.245.63","10.215.173.1","TCP","40","443  >  42068 [ACK] Seq=535 Ack=3058 Win=524032 Len=0"
"178","08:32:49.202204","157.240.245.63","10.215.173.1","TLSv1.3","75","Application Data"
"179","08:32:49.210585","10.215.173.1","157.240.245.63","TCP","40","42070  >  443 [ACK] Seq=3058 Ack=535 Win=67840 Len=0"
"180","08:32:49.220224","10.215.173.1","172.253.63.188","TLSv1.3","474","Application Data"
"181","08:32:49.220383","172.253.63.188","10.215.173.1","TCP","40","5228  >  58200 [ACK] Seq=6635 Ack=1016 Win=523776 Len=0"
"182","08:32:49.236796","172.253.63.188","10.215.173.1","TLSv1.3","575","Application Data, Application Data"
"183","08:32:49.236976","10.215.173.1","172.253.63.188","TCP","40","58200  >  5228 [ACK] Seq=1016 Ack=7170 Win=100864 Len=0"
"184","08:32:49.241813","10.215.173.1","157.240.245.63","TCP","40","42068  >  443 [ACK] Seq=3058 Ack=535 Win=67840 Len=0"
"185","08:32:49.254036","172.253.63.188","10.215.173.1","TLSv1.3","158","Application Data, Application Data"
"186","08:32:49.254320","10.215.173.1","172.253.63.188","TCP","40","58200  >  5228 [ACK] Seq=1016 Ack=7288 Win=100864 Len=0"
"187","08:32:49.265506","157.240.245.175","10.215.173.1","TCP","90","5222  >  43702 [PSH, ACK] Seq=242 Ack=3133 Win=524288 Len=50 [TCP PDU reassembled in 187]"
"188","08:32:49.309648","10.215.173.1","157.240.245.175","TCP","40","43702  >  5222 [ACK] Seq=3133 Ack=292 Win=65536 Len=0"
"189","08:32:49.340786","10.215.173.1","157.240.245.12","QUIC","1280","Initial, DCID=f0d99950a38d41ea, PKN: 2675665, CRYPTO, PADDING"
"190","08:32:49.371048","10.215.173.1","157.240.245.13","TLSv1.3","3931","Application Data"
"191","08:32:49.371261","157.240.245.13","10.215.173.1","TCP","40","443  >  33026 [ACK] Seq=1385 Ack=10720 Win=520192 Len=0"
"192","08:32:49.376271","157.240.245.13","10.215.173.1","TLSv1.3","75","Application Data"
"193","08:32:49.376391","10.215.173.1","157.240.245.13","TCP","40","33026  >  443 [ACK] Seq=10720 Ack=1420 Win=70144 Len=0"
"194","08:32:49.391023","157.240.245.63","10.215.173.1","TLSv1.3","1328","Application Data, Application Data"
"195","08:32:49.391197","10.215.173.1","157.240.245.63","TCP","40","42068  >  443 [ACK] Seq=3058 Ack=1823 Win=87808 Len=0"
"196","08:32:49.419671","157.240.245.13","10.215.173.1","TLSv1.3","326","Application Data"
"197","08:32:49.419797","10.215.173.1","157.240.245.13","TCP","40","33026  >  443 [ACK] Seq=10720 Ack=1706 Win=71168 Len=0"
"198","08:32:49.428119","10.215.173.1","157.240.245.13","TLSv1.3","1155","Application Data"
"199","08:32:49.428249","157.240.245.13","10.215.173.1","TCP","40","443  >  33026 [ACK] Seq=1706 Ack=11835 Win=523008 Len=0"
"200","08:32:49.432621","157.240.245.13","10.215.173.1","TLSv1.3","75","Application Data"
"201","08:32:49.473596","10.215.173.1","157.240.245.13","TCP","40","33026  >  443 [ACK] Seq=11835 Ack=1741 Win=71168 Len=0"
"202","08:32:49.500598","10.215.173.1","157.240.245.23","UDP","1253","57363  >  443 Len=1225"
"203","08:32:49.500946","10.215.173.1","157.240.245.23","UDP","1253","57363  >  443 Len=1225"
"204","08:32:49.505434","157.240.245.13","10.215.173.1","TLSv1.3","303","Application Data"
"205","08:32:49.505527","10.215.173.1","157.240.245.13","TCP","40","33026  >  443 [ACK] Seq=11835 Ack=2004 Win=72448 Len=0"
"206","08:32:49.599033","10.215.173.1","157.240.245.12","TCP","60","42712  >  443 [SYN] Seq=0 Win=65535 Len=0 MSS=9960 SACK_PERM TSval=3707235898 TSecr=0 WS=256"
"207","08:32:49.600883","10.215.173.1","10.215.173.2","DNS","67","Standard query 0x7cef A gateway.instagram.com"
"208","08:32:49.605520","157.240.245.12","10.215.173.1","TCP","48","443  >  42712 [SYN, ACK] Seq=0 Ack=1 Win=2048 Len=0 MSS=9960 WS=256"
"209","08:32:49.605687","10.215.173.1","157.240.245.12","TCP","40","42712  >  443 [ACK] Seq=1 Ack=1 Win=65536 Len=0"
"210","08:32:49.609428","10.215.173.2","10.215.173.1","DNS","118","Standard query response 0x7cef A gateway.instagram.com CNAME dgw.c10r.facebook.com A 157.240.245.12"
"211","08:32:49.610062","10.215.173.1","157.240.245.12","TLSv1.3","432","Client Hello (SNI=gateway.instagram.com)"
"212","08:32:49.610417","157.240.245.12","10.215.173.1","TCP","40","443  >  42712 [ACK] Seq=1 Ack=393 Win=523776 Len=0"
"213","08:32:49.616628","157.240.245.12","10.215.173.1","TLSv1.3","252","Server Hello, Change Cipher Spec, Application Data"
"214","08:32:49.617033","10.215.173.1","157.240.245.12","TCP","40","42712  >  443 [ACK] Seq=393 Ack=213 Win=66816 Len=0"
"215","08:32:49.624604","10.215.173.1","157.240.245.12","TLSv1.3","46","Change Cipher Spec"
"216","08:32:49.624784","157.240.245.12","10.215.173.1","TCP","40","443  >  42712 [ACK] Seq=213 Ack=399 Win=524032 Len=0"
"217","08:32:49.625534","10.215.173.1","157.240.245.12","TLSv1.3","109","Application Data"
"218","08:32:49.625684","157.240.245.12","10.215.173.1","TCP","40","443  >  42712 [ACK] Seq=213 Ack=468 Win=524032 Len=0"
"219","08:32:49.627001","10.215.173.1","157.240.245.12","TLSv1.3","93","Application Data"
"220","08:32:49.627137","157.240.245.12","10.215.173.1","TCP","40","443  >  42712 [ACK] Seq=213 Ack=521 Win=524032 Len=0"
"221","08:32:49.627398","10.215.173.1","157.240.245.12","TLSv1.3","93","Application Data"
"222","08:32:49.627524","157.240.245.12","10.215.173.1","TCP","40","443  >  42712 [ACK] Seq=213 Ack=574 Win=524032 Len=0"
"223","08:32:49.627750","10.215.173.1","157.240.245.12","TLSv1.3","77","Application Data"
"224","08:32:49.627863","157.240.245.12","10.215.173.1","TCP","40","443  >  42712 [ACK] Seq=213 Ack=611 Win=524032 Len=0"
"225","08:32:49.628119","10.215.173.1","157.240.245.12","TLSv1.3","717","Application Data"
"226","08:32:49.628234","157.240.245.12","10.215.173.1","TCP","40","443  >  42712 [ACK] Seq=213 Ack=1288 Win=523264 Len=0"
"227","08:32:49.628724","10.215.173.1","157.240.245.12","TLSv1.3","1373","Application Data"
"228","08:32:49.628871","157.240.245.12","10.215.173.1","TCP","40","443  >  42712 [ACK] Seq=213 Ack=2621 Win=521984 Len=0"
"229","08:32:49.629782","157.240.245.12","10.215.173.1","TLSv1.3","294","Application Data, Application Data"
"230","08:32:49.630165","10.215.173.1","157.240.245.12","TLSv1.3","77","Application Data"
"231","08:32:49.630209","157.240.245.12","10.215.173.1","TCP","40","443  >  42712 [ACK] Seq=467 Ack=2658 Win=521984 Len=0"
"232","08:32:49.632844","157.240.245.12","10.215.173.1","TLSv1.3","106","Application Data, Application Data"
"233","08:32:49.651671","157.240.245.12","10.215.173.1","TLSv1.3","255","Application Data, Application Data"
"234","08:32:49.652771","10.215.173.1","157.240.245.12","TCP","40","42712  >  443 [ACK] Seq=2658 Ack=748 Win=68864 Len=0"
"235","08:32:49.704064","10.215.173.1","157.240.245.23","UDP","1260","57363  >  443 Len=1232"
"236","08:32:49.704378","10.215.173.1","157.240.245.23","UDP","1260","57363  >  443 Len=1232"
"237","08:32:49.706815","10.215.173.1","157.240.245.23","UDP","1260","57363  >  443 Len=1232"
"238","08:32:49.706963","10.215.173.1","157.240.245.23","UDP","1260","57363  >  443 Len=1232"
"239","08:32:49.707081","10.215.173.1","157.240.245.23","UDP","1260","57363  >  443 Len=1232"
"240","08:32:49.707162","10.215.173.1","157.240.245.23","UDP","844","57363  >  443 Len=816"
"241","08:32:50.141188","10.215.173.1","157.240.245.12","QUIC","1280","Initial, DCID=f0d99950a38d41ea, PKN: 2675667, CRYPTO, PADDING"
"242","08:32:50.231892","10.215.173.1","157.240.245.63","TLSv1.3","2301","Application Data"
"243","08:32:50.231927","10.215.173.1","157.240.245.63","TLSv1.3","141","Application Data"
"244","08:32:50.231941","10.215.173.1","157.240.245.63","TLSv1.3","77","Application Data"
"245","08:32:50.232180","157.240.245.63","10.215.173.1","TCP","40","443  >  42068 [ACK] Seq=1823 Ack=5457 Win=521728 Len=0"
"246","08:32:50.235485","157.240.245.63","10.215.173.1","TLSv1.3","75","Application Data"
"247","08:32:50.235609","10.215.173.1","157.240.245.63","TCP","40","42068  >  443 [ACK] Seq=5457 Ack=1858 Win=87808 Len=0"
"248","08:32:50.376147","157.240.245.63","10.215.173.1","TLSv1.3","1890","Application Data, Application Data"
"249","08:32:50.376245","10.215.173.1","157.240.245.63","TCP","40","42068  >  443 [ACK] Seq=5457 Ack=3708 Win=91392 Len=0"
"250","08:32:50.434434","10.215.173.1","157.240.245.63","TLSv1.3","2317","Application Data"
"251","08:32:50.434660","157.240.245.63","10.215.173.1","TCP","40","443  >  42068 [ACK] Seq=3708 Ack=7734 Win=521984 Len=0"
"252","08:32:50.441048","157.240.245.63","10.215.173.1","TLSv1.3","75","Application Data"
"253","08:32:50.441110","10.215.173.1","157.240.245.63","TCP","40","42068  >  443 [ACK] Seq=7734 Ack=3743 Win=91392 Len=0"
"254","08:32:50.469560","157.240.245.63","10.215.173.1","TLSv1.3","1333","Application Data, Application Data"
"255","08:32:50.513759","10.215.173.1","157.240.245.63","TCP","40","42070  >  443 [ACK] Seq=3058 Ack=1828 Win=87808 Len=0"
"256","08:32:50.513806","157.240.245.63","10.215.173.1","TLSv1.3","1239","Application Data, Application Data"
"257","08:32:50.513943","10.215.173.1","157.240.245.63","TCP","40","42068  >  443 [ACK] Seq=7734 Ack=4942 Win=111360 Len=0"
"258","08:32:50.622711","10.215.173.1","157.240.245.23","UDP","1253","57363  >  443 Len=1225"
"259","08:32:50.622971","10.215.173.1","157.240.245.23","UDP","1253","57363  >  443 Len=1225"
"260","08:32:50.700125","10.215.173.1","157.240.245.23","UDP","1260","57363  >  443 Len=1232"
"261","08:32:50.700388","10.215.173.1","157.240.245.23","UDP","1260","57363  >  443 Len=1232"
"262","08:32:50.700451","10.215.173.1","157.240.245.23","UDP","1260","57363  >  443 Len=1232"
"263","08:32:50.700503","10.215.173.1","157.240.245.23","UDP","1260","57363  >  443 Len=1232"
"264","08:32:50.700545","10.215.173.1","157.240.245.23","UDP","1260","57363  >  443 Len=1232"
"265","08:32:50.700582","10.215.173.1","157.240.245.23","UDP","1260","57363  >  443 Len=1232"
"266","08:32:50.700630","10.215.173.1","157.240.245.23","UDP","1260","57363  >  443 Len=1232"
"267","08:32:50.700682","10.215.173.1","157.240.245.23","UDP","1260","57363  >  443 Len=1232"
"268","08:32:50.700727","10.215.173.1","157.240.245.23","UDP","1260","57363  >  443 Len=1232"
"269","08:32:50.700781","10.215.173.1","157.240.245.23","UDP","1260","57363  >  443 Len=1232"
"270","08:32:50.700833","10.215.173.1","157.240.245.23","UDP","1260","57363  >  443 Len=1232"
"271","08:32:50.804471","10.215.173.1","157.240.245.63","QUIC","1280","Initial, DCID=30915040757426ad, PKN: 7692408, CRYPTO, PADDING"
"272","08:32:50.829435","10.215.173.1","157.240.245.12","QUIC","1280","Initial, DCID=89b9602a4141ec20, PKN: 2697665, CRYPTO, PADDING"
"273","08:32:51.133053","10.215.173.1","157.240.245.63","TLSv1.3","2285","Application Data"
"274","08:32:51.133239","10.215.173.1","157.240.245.63","TLSv1.3","221","Application Data"
"275","08:32:51.133249","10.215.173.1","157.240.245.63","TLSv1.3","77","Application Data"
"276","08:32:51.133399","157.240.245.63","10.215.173.1","TCP","40","443  >  42068 [ACK] Seq=4942 Ack=10197 Win=521728 Len=0"
"277","08:32:51.141743","157.240.245.63","10.215.173.1","TLSv1.3","75","Application Data"
"278","08:32:51.141884","10.215.173.1","157.240.245.63","TCP","40","42068  >  443 [ACK] Seq=10197 Ack=4977 Win=111360 Len=0"
"279","08:32:51.146112","10.215.173.1","157.240.245.13","TLSv1.3","4666","Application Data"
"280","08:32:51.146252","157.240.245.13","10.215.173.1","TCP","40","443  >  33026 [ACK] Seq=2004 Ack=16461 Win=519424 Len=0"
"281","08:32:51.152515","157.240.245.13","10.215.173.1","TLSv1.3","75","Application Data"
"282","08:32:51.152717","10.215.173.1","157.240.245.13","TCP","40","33026  >  443 [ACK] Seq=16461 Ack=2039 Win=72448 Len=0"
"283","08:32:51.200375","157.240.245.13","10.215.173.1","TLSv1.3","326","Application Data"
"284","08:32:51.200868","10.215.173.1","157.240.245.13","TCP","40","33026  >  443 [ACK] Seq=16461 Ack=2325 Win=73472 Len=0"
"285","08:32:51.205711","10.215.173.1","157.240.245.13","TLSv1.3","1253","Application Data"
"286","08:32:51.205829","157.240.245.13","10.215.173.1","TCP","40","443  >  33026 [ACK] Seq=2325 Ack=17674 Win=523008 Len=0"
"287","08:32:51.210033","157.240.245.13","10.215.173.1","TLSv1.3","75","Application Data"
"288","08:32:51.242233","157.240.245.13","10.215.173.1","TLSv1.3","303","Application Data"
"289","08:32:51.242594","10.215.173.1","157.240.245.13","TCP","40","33026  >  443 [ACK] Seq=17674 Ack=2623 Win=74752 Len=0"
"290","08:32:51.243578","10.215.173.1","157.240.245.13","TLSv1.3","1551","Application Data"
"291","08:32:51.243662","157.240.245.13","10.215.173.1","TCP","40","443  >  33026 [ACK] Seq=2623 Ack=19185 Win=522752 Len=0"
"292","08:32:51.247121","157.240.245.13","10.215.173.1","TLSv1.3","75","Application Data"
"293","08:32:51.289479","10.215.173.1","157.240.245.13","TCP","40","33026  >  443 [ACK] Seq=19185 Ack=2658 Win=74752 Len=0"
"294","08:32:51.293400","157.240.245.13","10.215.173.1","TLSv1.3","302","Application Data"
"295","08:32:51.293481","10.215.173.1","157.240.245.13","TCP","40","33026  >  443 [ACK] Seq=19185 Ack=2920 Win=76032 Len=0"
"296","08:32:51.296547","10.215.173.1","157.240.245.13","TLSv1.3","1003","Application Data"
"297","08:32:51.296627","157.240.245.13","10.215.173.1","TCP","40","443  >  33026 [ACK] Seq=2920 Ack=20148 Win=523264 Len=0"
"298","08:32:51.301504","157.240.245.13","10.215.173.1","TLSv1.3","75","Application Data"
"299","08:32:51.320500","157.240.245.63","10.215.173.1","TLSv1.3","567","Application Data, Application Data"
"300","08:32:51.320662","10.215.173.1","157.240.245.63","TCP","40","42068  >  443 [ACK] Seq=10197 Ack=5504 Win=114944 Len=0"
"301","08:32:51.333707","157.240.245.13","10.215.173.1","TLSv1.3","304","Application Data"
"302","08:32:51.334343","10.215.173.1","157.240.245.13","TCP","40","33026  >  443 [ACK] Seq=20148 Ack=3219 Win=77056 Len=0"
"303","08:32:51.495576","10.215.173.1","10.215.173.2","DNS","64","Standard query 0x26bb AAAA graph.facebook.com"
"304","08:32:51.501602","10.215.173.2","10.215.173.1","DNS","128","Standard query response 0x26bb AAAA graph.facebook.com CNAME star.c10r.facebook.com AAAA 2a03:2880:f07e:e:face:b00c:0:2"
"305","08:32:51.504204","10.215.173.1","157.240.245.13","TCP","60","33042  >  443 [SYN] Seq=0 Win=65535 Len=0 MSS=9960 SACK_PERM TSval=1048730777 TSecr=0 WS=256"
"306","08:32:51.509439","157.240.245.13","10.215.173.1","TCP","48","443  >  33042 [SYN, ACK] Seq=0 Ack=1 Win=2048 Len=0 MSS=9960 WS=256"
"307","08:32:51.509562","10.215.173.1","157.240.245.13","TCP","40","33042  >  443 [ACK] Seq=1 Ack=1 Win=65536 Len=0"
"308","08:32:51.511282","10.215.173.1","157.240.245.13","TLSv1.3","557","Client Hello (SNI=graph.facebook.com)"
"309","08:32:51.511448","157.240.245.13","10.215.173.1","TCP","40","443  >  33042 [ACK] Seq=1 Ack=518 Win=523520 Len=0"
"310","08:32:51.519543","157.240.245.13","10.215.173.1","TLSv1.3","3334","Server Hello, Change Cipher Spec, Application Data, Application Data, Application Data"
"311","08:32:51.519730","10.215.173.1","157.240.245.13","TCP","40","33042  >  443 [ACK] Seq=518 Ack=3295 Win=85504 Len=0"
"312","08:32:51.521931","10.215.173.1","157.240.245.13","TLSv1.3","104","Change Cipher Spec, Application Data"
"313","08:32:51.521954","10.215.173.1","157.240.245.13","TCP","10000","33042  >  443 [ACK] Seq=582 Ack=3295 Win=85504 Len=9960 [TCP PDU reassembled in 314]"
"314","08:32:51.521977","10.215.173.1","157.240.245.13","TLSv1.3","6486","Application Data"
"315","08:32:51.521982","10.215.173.1","157.240.245.13","TLSv1.3","1556","Application Data"
"316","08:32:51.522100","157.240.245.13","10.215.173.1","TCP","40","443  >  33042 [ACK] Seq=3295 Ack=18504 Win=506112 Len=0"
"317","08:32:51.526873","157.240.245.13","10.215.173.1","TLSv1.3","225","Application Data"
"318","08:32:51.540398","10.215.173.1","157.240.245.63","TLSv1.3","701","Application Data"
"319","08:32:51.541008","10.215.173.1","157.240.245.63","TLSv1.3","445","Application Data"
"320","08:32:51.541014","10.215.173.1","157.240.245.63","TLSv1.3","77","Application Data"
"321","08:32:51.542741","157.240.245.63","10.215.173.1","TCP","40","443  >  42068 [ACK] Seq=5504 Ack=11300 Win=523008 Len=0"
"322","08:32:51.546966","157.240.245.63","10.215.173.1","TLSv1.3","75","Application Data"
"323","08:32:51.547041","10.215.173.1","157.240.245.63","TCP","40","42068  >  443 [ACK] Seq=11300 Ack=5539 Win=114944 Len=0"
"324","08:32:51.569438","10.215.173.1","157.240.245.13","TCP","40","33042  >  443 [ACK] Seq=18504 Ack=3480 Win=92160 Len=0"
"325","08:32:51.641258","157.240.245.13","10.215.173.1","TLSv1.3","923","Application Data"
"326","08:32:51.641426","10.215.173.1","157.240.245.13","TCP","40","33042  >  443 [ACK] Seq=18504 Ack=4363 Win=98816 Len=0"
"327","08:32:51.644017","10.215.173.1","157.240.245.13","TLSv1.3","64","Application Data"
"328","08:32:51.644144","157.240.245.13","10.215.173.1","TCP","40","443  >  33042 [ACK] Seq=4363 Ack=18528 Win=524032 Len=0"
"329","08:32:51.645276","10.215.173.1","157.240.245.13","TCP","40","33042  >  443 [FIN, ACK] Seq=18528 Ack=4363 Win=98816 Len=0"
"330","08:32:51.645420","157.240.245.13","10.215.173.1","TCP","40","443  >  33042 [ACK] Seq=4363 Ack=18529 Win=524032 Len=0"
"331","08:32:51.648849","157.240.245.13","10.215.173.1","TLSv1.3","64","Application Data"
"332","08:32:51.648962","10.215.173.1","157.240.245.13","TCP","40","33042  >  443 [RST] Seq=18529 Win=0 Len=0"
"333","08:32:51.648987","157.240.245.13","10.215.173.1","TCP","40","443  >  33042 [RST, ACK] Seq=4387 Ack=18529 Win=65280 Len=0"
"334","08:32:51.743161","10.215.173.1","157.240.245.12","QUIC","1280","Initial, DCID=f0d99950a38d41ea, PKN: 2675669, CRYPTO, PADDING"
"335","08:32:51.840288","10.215.173.1","157.240.245.63","QUIC","1280","Initial, DCID=91b13be6cfec6489, PKN: 16676612, CRYPTO, PADDING"
"336","08:32:51.903809","157.240.245.63","10.215.173.1","TLSv1.3","3267","Application Data, Application Data"
"337","08:32:51.914327","10.215.173.1","157.240.245.63","TCP","40","42068  >  443 [ACK] Seq=11300 Ack=8766 Win=134912 Len=0"
"338","08:32:52.409570","10.215.173.1","157.240.245.63","TLSv1.3","2141","Application Data"
"339","08:32:52.409772","10.215.173.1","157.240.245.63","TLSv1.3","141","Application Data"
"340","08:32:52.409795","10.215.173.1","157.240.245.63","TLSv1.3","77","Application Data"
"341","08:32:52.410031","157.240.245.63","10.215.173.1","TCP","40","443  >  42068 [ACK] Seq=8766 Ack=13539 Win=521984 Len=0"
"342","08:32:52.419358","157.240.245.63","10.215.173.1","TLSv1.3","75","Application Data"
"343","08:32:52.419510","10.215.173.1","157.240.245.63","TCP","40","42068  >  443 [ACK] Seq=13539 Ack=8801 Win=134912 Len=0"
"344","08:32:52.535402","10.215.173.1","157.240.245.23","UDP","1260","57363  >  443 Len=1232"
"345","08:32:52.535958","10.215.173.1","157.240.245.23","UDP","1260","57363  >  443 Len=1232"
"346","08:32:52.538719","10.215.173.1","157.240.245.63","TLSv1.3","2349","Application Data"
"347","08:32:52.539063","157.240.245.63","10.215.173.1","TCP","40","443  >  42070 [ACK] Seq=1828 Ack=5367 Win=521728 Len=0"
"348","08:32:52.544986","157.240.245.63","10.215.173.1","TLSv1.3","75","Application Data"
"349","08:32:52.545134","10.215.173.1","157.240.245.63","TCP","40","42070  >  443 [ACK] Seq=5367 Ack=1863 Win=87808 Len=0"
